While tcpdump host your_host is running in one command window, run ping 127.0.0.1 from
another command window. From the ping output, is the 127.0.0.1 interface on? Can you see any
ICMP message sent from your host in the tcpdump output? Why?



answer:

no tcpdump not visible.coz the packets are routed internally within os network, instead of being traversing via physical network.

sudo tcpdump host 172.16.48.95
tcpdump: verbose output suppressed, use -v[v]... for full protocol decode
listening on enp2s0, link-type EN10MB (Ethernet), snapshot length 262144 bytes
10:07:40.880642 ARP, Request who-has _gateway tell selab-03, length 28
10:07:40.881669 ARP, Reply _gateway is-at 00:00:0c:07:ac:30 (oui Cisco), length 46
10:07:40.908995 IP selab-03.49785 > MPL-DC-DC01.manipal.edu.domain: 10426+ [1au] PTR? 1.48.16.172.in-addr.arpa. (53)
10:07:41.059680 IP MPL-DC-DC01.manipal.edu.domain > selab-03.49785: 10426 NXDomain 0/1/1 (130)
10:07:41.059787 IP selab-03.49785 > MPL-DC-DC01.manipal.edu.domain: 10426+ PTR? 1.48.16.172.in-addr.arpa. (42)
10:07:41.060079 IP MPL-DC-DC01.manipal.edu.domain > selab-03.49785: 10426 NXDomain 0/1/0 (119)
10:07:41.060383 IP selab-03.55800 > MPL-DC-DC01.manipal.edu.domain: 16723+ [1au] PTR? 95.48.16.172.in-addr.arpa. (54)
10:07:41.060784 IP MPL-DC-DC01.manipal.edu.domain > selab-03.55800: 16723 NXDomain 0/1/1 (131)
10:07:41.060824 IP selab-03.55800 > MPL-DC-DC01.manipal.edu.domain: 16723+ PTR? 95.48.16.172.in-addr.arpa. (43)
10:07:41.061485 IP MPL-DC-DC01.manipal.edu.domain > selab-03.55800: 16723 NXDomain 0/1/0 (120)
10:08:08.689858 IP lb-140-82-114-25-iad.github.com.https > selab-03.42616: Flags [P.], seq 4110246477:4110246503, ack 3593786354, win 71, options [nop,nop,TS val 3023529584 ecr 1174203171], length 26
10:08:08.689981 IP selab-03.42616 > lb-140-82-114-25-iad.github.com.https: Flags [P.], seq 1:31, ack 26, win 501, options [nop,nop,TS val 1174263171 ecr 3023529584], length 30
10:08:09.017017 IP lb-140-82-114-25-iad.github.com.https > selab-03.42616: Flags [.], ack 31, win 71, options [nop,nop,TS val 3023529912 ecr 1174263171], length 0
10:08:10.173872 IP 55.65.117.34.bc.googleusercontent.com.https > selab-03.46496: Flags [P.], seq 1475317219:1475317243, ack 492296726, win 272, options [nop,nop,TS val 206394854 ecr 1913245811], length 24
10:08:10.173993 IP selab-03.46496 > 55.65.117.34.bc.googleusercontent.com.https: Flags [P.], seq 1:29, ack 24, win 501, options [nop,nop,TS val 1913546043 ecr 206394854], length 28
10:08:10.201140 IP 55.65.117.34.bc.googleusercontent.com.https > selab-03.46496: Flags [.], ack 29, win 272, options [nop,nop,TS val 206394881 ecr 1913546043], length 0
10:08:10.264788 IP selab-03.48061 > MPL-DC-DC01.manipal.edu.domain: 14523+ [1au] PTR? 55.65.117.34.in-addr.arpa. (54)
10:08:10.327464 IP MPL-DC-DC01.manipal.edu.domain > selab-03.48061: 14523 1/0/1 PTR 55.65.117.34.bc.googleusercontent.com. (105)
10:09:08.693485 IP lb-140-82-114-25-iad.github.com.https > selab-03.42616: Flags [P.], seq 26:52, ack 31, win 71, options [nop,nop,TS val 3023589585 ecr 1174263171], length 26
10:09:08.693579 IP selab-03.42616 > lb-140-82-114-25-iad.github.com.https: Flags [P.], seq 31:61, ack 52, win 501, options [nop,nop,TS val 1174323174 ecr 3023589585], length 30
10:09:09.020702 IP lb-140-82-114-25-iad.github.com.https > selab-03.42616: Flags [.], ack 61, win 71, options [nop,nop,TS val 3023589912 ecr 1174323174], length 0
10:09:13.808447 ARP, Request who-has _gateway tell selab-03, length 28
10:09:13.809496 ARP, Reply _gateway is-at 00:00:0c:07:ac:30 (oui Cisco), length 46
10:09:32.290628 IP selab-03.36773 > MPL-DC-DC01.manipal.edu.domain: 4421+ [1au] AAAA? connectivity-check.ubuntu.com. (58)
10:09:32.291021 IP MPL-DC-DC01.manipal.edu.domain > selab-03.36773: 4421 6/0/1 AAAA 2620:2d:4000:1::22, AAAA 2001:67c:1562::23, AAAA 2620:2d:4000:1::2b, AAAA 2620:2d:4000:1::2a, AAAA 2620:2d:4000:1::23, AAAA 2001:67c:1562::24 (226)
10:09:56.469104 IP selab-03.58262 > MPL-DC-DC01.manipal.edu.domain: 32919+ [1au] A? ntp.ubuntu.com. (43)
10:09:56.469137 IP selab-03.48049 > MPL-DC-DC01.manipal.edu.domain: 7103+ [1au] AAAA? ntp.ubuntu.com. (43)
10:09:56.617615 IP MPL-DC-DC01.manipal.edu.domain > selab-03.48049: 7103 3/0/1 AAAA 2620:2d:4000:1::41, AAAA 2620:2d:4000:1::3f, AAAA 2620:2d:4000:1::40 (127)
10:09:56.622318 IP MPL-DC-DC01.manipal.edu.domain > selab-03.58262: 32919 5/0/1 A 91.189.94.4, A 185.125.190.58, A 185.125.190.57, A 91.189.91.157, A 185.125.190.56 (123)
10:09:56.622666 IP selab-03.49098 > pugot.canonical.com.ntp: NTPv4, Client, length 48
10:09:56.660909 IP selab-03.35239 > MPL-DC-DC01.manipal.edu.domain: 22899+ [1au] PTR? 4.94.189.91.in-addr.arpa. (53)
10:09:56.661297 IP MPL-DC-DC01.manipal.edu.domain > selab-03.35239: 22899 1/0/1 PTR pugot.canonical.com. (86)
10:10:01.680621 ARP, Request who-has _gateway tell selab-03, length 28
10:10:01.681618 ARP, Reply _gateway is-at 00:00:0c:07:ac:30 (oui Cisco), length 46
10:10:06.719057 IP selab-03.39740 > prod-ntp-5.ntp4.ps5.canonical.com.ntp: NTPv4, Client, length 48
10:10:06.772731 IP selab-03.50821 > MPL-DC-DC01.manipal.edu.domain: 47684+ [1au] PTR? 58.190.125.185.in-addr.arpa. (56)
10:10:06.773195 IP MPL-DC-DC01.manipal.edu.domain > selab-03.50821: 47684 2/0/1 PTR prod-ntp-5.ntp4.ps5.canonical.com., PTR prod-ntp-5.ntp1.ps5.canonical.com. (133)
^C
37 packets captured
37 packets received by filter
0 packets dropped by kernel

(base) student@selab-03:~$ ping 127.0.0.1
PING 127.0.0.1 (127.0.0.1) 56(84) bytes of data.
64 bytes from 127.0.0.1: icmp_seq=1 ttl=64 time=0.025 ms
64 bytes from 127.0.0.1: icmp_seq=2 ttl=64 time=0.023 ms
64 bytes from 127.0.0.1: icmp_seq=3 ttl=64 time=0.023 ms
64 bytes from 127.0.0.1: icmp_seq=4 ttl=64 time=0.023 ms
64 bytes from 127.0.0.1: icmp_seq=5 ttl=64 time=0.023 ms
64 bytes from 127.0.0.1: icmp_seq=6 ttl=64 time=0.023 ms
^C
--- 127.0.0.1 ping statistics ---
6 packets transmitted, 6 received, 0% packet loss, time 5099ms
rtt min/avg/max/mdev = 0.023/0.023/0.025/0.000 ms

