While tcpdump host your_host is running to capture traffic from your machine, execute telnet
128.238.66.200. Note there is no host with this IP address in the current configuration of the lab
network. Save the tcpdump output of the first few packets for the lab report. After getting the
necessary output, terminate the telnet session. From the saved tcpdump output, describe how the
ARP timeout and retransmission were performed. How many attempts were made to resolve a
non-existing IP address?



answer:

When attempting to connect to the non-existing IP address (128.238.66.200) via telnet, the following sequence of events may be captured in the tcpdump output:

    The telnet application sends an ARP request asking for the MAC address corresponding to the IP address 128.238.66.200.

    As there is no host with this IP address in the current configuration of the lab network, no ARP response is received within the expected timeframe (ARP timeout).

    The telnet application retransmits the ARP request, possibly with an incremented attempt count.

    Again, no ARP response is received within the expected timeframe, triggering another ARP retransmission.

    This process continues for a certain number of attempts until a maximum retry threshold is reached or an ARP response is received.

Total 4 attempts were made



sudo tcpdump host 172.16.48.95
tcpdump: verbose output suppressed, use -v[v]... for full protocol decode
listening on enp2s0, link-type EN10MB (Ethernet), snapshot length 262144 bytes
10:30:23.454777 IP selab-03.44145 > mpl-dc-adc01.manipal.edu.domain: 47051+ [1au] A? selab-03.mahe.manipal.net. (54)
10:30:23.455244 IP mpl-dc-adc01.manipal.edu.domain > selab-03.44145: 47051 NXDomain 0/1/1 (122)
10:30:23.455351 IP selab-03.44145 > mpl-dc-adc01.manipal.edu.domain: 47051+ A? selab-03.mahe.manipal.net. (43)
10:30:23.455570 IP mpl-dc-adc01.manipal.edu.domain > selab-03.44145: 47051 NXDomain 0/1/0 (111)
10:30:23.455938 IP selab-03.48132 > vm-host-1.isis.poly.edu.telnet: Flags [S], seq 1360721614, win 64240, options [mss 1460,sackOK,TS val 2154477891 ecr 0,nop,wscale 7], length 0
10:30:23.468885 IP selab-03.60709 > mpl-dc-adc01.manipal.edu.domain: 27508+ [1au] PTR? 203.19.16.172.in-addr.arpa. (55)
10:30:23.469186 IP mpl-dc-adc01.manipal.edu.domain > selab-03.60709: 27508* 1/0/1 PTR mpl-dc-adc01.manipal.edu. (93)
10:30:23.469585 IP selab-03.45218 > mpl-dc-adc01.manipal.edu.domain: 44869+ [1au] PTR? 95.48.16.172.in-addr.arpa. (54)
10:30:23.469950 IP mpl-dc-adc01.manipal.edu.domain > selab-03.45218: 44869 NXDomain 0/1/1 (113)
10:30:23.469977 IP selab-03.45218 > mpl-dc-adc01.manipal.edu.domain: 44869+ PTR? 95.48.16.172.in-addr.arpa. (43)
10:30:23.470185 IP mpl-dc-adc01.manipal.edu.domain > selab-03.45218: 44869 NXDomain 0/1/0 (102)
10:30:23.470524 IP selab-03.53766 > mpl-dc-adc01.manipal.edu.domain: 41138+ [1au] PTR? 200.66.238.128.in-addr.arpa. (56)
10:30:23.470917 IP mpl-dc-adc01.manipal.edu.domain > selab-03.53766: 41138 1/0/1 PTR vm-host-1.isis.poly.edu. (93)
10:30:24.464602 IP selab-03.48132 > vm-host-1.isis.poly.edu.telnet: Flags [S], seq 1360721614, win 64240, options [mss 1460,sackOK,TS val 2154478899 ecr 0,nop,wscale 7], length 0
10:30:25.693286 ARP, Request who-has selab-03 tell 172.16.48.22, length 46
10:30:25.693307 ARP, Reply selab-03 is-at 48:9e:bd:9f:a6:aa (oui Unknown), length 28
10:30:25.693848 IP 172.16.48.22.netbios-ssn > selab-03.41892: Flags [.], seq 2270684757:2270684758, ack 1139762198, win 65, length 1
10:30:25.693865 IP selab-03.41892 > 172.16.48.22.netbios-ssn: Flags [.], ack 1, win 501, options [nop,nop,TS val 3803169671 ecr 481660,nop,nop,sack 1 {0:1}], length 0
10:30:25.756792 IP selab-03.35509 > mpl-dc-adc01.manipal.edu.domain: 50056+ [1au] PTR? 22.48.16.172.in-addr.arpa. (54)
10:30:25.785751 IP mpl-dc-adc01.manipal.edu.domain > selab-03.35509: 50056 NXDomain 0/1/1 (113)
10:30:25.785880 IP selab-03.35509 > mpl-dc-adc01.manipal.edu.domain: 50056+ PTR? 22.48.16.172.in-addr.arpa. (43)
10:30:25.786239 IP mpl-dc-adc01.manipal.edu.domain > selab-03.35509: 50056 NXDomain 0/1/0 (102)
10:30:26.480633 IP selab-03.48132 > vm-host-1.isis.poly.edu.telnet: Flags [S], seq 1360721614, win 64240, options [mss 1460,sackOK,TS val 2154480915 ecr 0,nop,wscale 7], length 0
10:30:29.199972 IP selab-03.46912 > 239.237.117.34.bc.googleusercontent.com.https: Flags [P.], seq 131549056:131549095, ack 202138924, win 501, options [nop,nop,TS val 1416598690 ecr 1961392423], length 39
10:30:29.199993 IP selab-03.33018 > 102.115.120.34.bc.googleusercontent.com.https: Flags [P.], seq 849122669:849122708, ack 2757296929, win 501, options [nop,nop,TS val 2034121161 ecr 3159097252], length 39
10:30:29.234812 IP 102.115.120.34.bc.googleusercontent.com.https > selab-03.33018: Flags [.], ack 39, win 273, options [nop,nop,TS val 3159155298 ecr 2034121161], length 0
10:30:29.234813 IP 239.237.117.34.bc.googleusercontent.com.https > selab-03.46912: Flags [.], ack 39, win 272, options [nop,nop,TS val 1961450665 ecr 1416598690], length 0
10:30:29.234813 IP 239.237.117.34.bc.googleusercontent.com.https > selab-03.46912: Flags [P.], seq 1:40, ack 39, win 272, options [nop,nop,TS val 1961450665 ecr 1416598690], length 39
10:30:29.234813 IP 102.115.120.34.bc.googleusercontent.com.https > selab-03.33018: Flags [P.], seq 1:40, ack 39, win 273, options [nop,nop,TS val 3159155298 ecr 2034121161], length 39
10:30:29.276497 IP selab-03.33018 > 102.115.120.34.bc.googleusercontent.com.https: Flags [.], ack 40, win 501, options [nop,nop,TS val 2034121237 ecr 3159155298], length 0
10:30:29.276501 IP selab-03.46912 > 239.237.117.34.bc.googleusercontent.com.https: Flags [.], ack 40, win 501, options [nop,nop,TS val 1416598766 ecr 1961450665], length 0
10:30:29.300820 IP selab-03.33969 > mpl-dc-adc01.manipal.edu.domain: 38622+ [1au] PTR? 239.237.117.34.in-addr.arpa. (56)
10:30:29.301193 IP mpl-dc-adc01.manipal.edu.domain > selab-03.33969: 38622 1/0/1 PTR 239.237.117.34.bc.googleusercontent.com. (109)
10:30:29.301511 IP selab-03.45372 > mpl-dc-adc01.manipal.edu.domain: 57965+ [1au] PTR? 102.115.120.34.in-addr.arpa. (56)
10:30:29.332414 IP mpl-dc-adc01.manipal.edu.domain > selab-03.45372: 57965 1/0/1 PTR 102.115.120.34.bc.googleusercontent.com. (109)
10:30:30.736613 ARP, Request who-has 172.16.48.22 tell selab-03, length 28
10:30:30.736622 IP selab-03.48132 > vm-host-1.isis.poly.edu.telnet: Flags [S], seq 1360721614, win 64240, options [mss 1460,sackOK,TS val 2154485171 ecr 0,nop,wscale 7], length 0
10:30:30.737389 ARP, Reply 172.16.48.22 is-at 8c:89:a5:e8:c9:3e (oui Unknown), length 46
10:30:38.928636 IP selab-03.48132 > vm-host-1.isis.poly.edu.telnet: Flags [S], seq 1360721614, win 64240, options [mss 1460,sackOK,TS val 2154493363 ecr 0,nop,wscale 7], length 0
10:30:55.056625 IP selab-03.48132 > vm-host-1.isis.poly.edu.telnet: Flags [S], seq 1360721614, win 64240, options [mss 1460,sackOK,TS val 2154509491 ecr 0,nop,wscale 7], length 0
10:30:55.200384 IP selab-03.52146 > bom07s16-in-f2.1e100.net.https: Flags [P.], seq 2108974966:2108975005, ack 683587936, win 501, options [nop,nop,TS val 1253869811 ecr 2062090236], length 39
10:30:55.200408 IP selab-03.57774 > bom12s21-in-f14.1e100.net.https: Flags [P.], seq 1307072532:1307072571, ack 3409257606, win 501, options [nop,nop,TS val 842663679 ecr 363215503], length 39
10:30:55.246615 IP bom12s21-in-f14.1e100.net.https > selab-03.57774: Flags [P.], seq 1:40, ack 39, win 265, options [nop,nop,TS val 363274069 ecr 842663679], length 39
10:30:55.246635 IP selab-03.57774 > bom12s21-in-f14.1e100.net.https: Flags [.], ack 40, win 501, options [nop,nop,TS val 842663725 ecr 363274069], length 0
10:30:55.253034 IP selab-03.54276 > mpl-dc-adc01.manipal.edu.domain: 582+ [1au] PTR? 194.160.217.172.in-addr.arpa. (57)
10:30:55.253434 IP mpl-dc-adc01.manipal.edu.domain > selab-03.54276: 582 1/0/1 PTR bom07s16-in-f2.1e100.net. (95)
10:30:55.253762 IP selab-03.43192 > mpl-dc-adc01.manipal.edu.domain: 29078+ [1au] PTR? 78.42.251.142.in-addr.arpa. (55)
10:30:55.254095 IP mpl-dc-adc01.manipal.edu.domain > selab-03.43192: 29078 1/0/1 PTR bom12s21-in-f14.1e100.net. (94)
10:30:55.261067 IP bom07s16-in-f2.1e100.net.https > selab-03.52146: Flags [P.], seq 1:40, ack 39, win 269, options [nop,nop,TS val 2062148807 ecr 1253869811], length 39
10:30:55.261090 IP selab-03.52146 > bom07s16-in-f2.1e100.net.https: Flags [.], ack 40, win 501, options [nop,nop,TS val 1253869872 ecr 2062148807], length 0
10:30:56.200613 IP selab-03.54784 > bom12s13-in-f2.1e100.net.https: Flags [P.], seq 646012333:646012372, ack 2749217170, win 501, options [nop,nop,TS val 2507564863 ecr 1984701716], length 39
10:30:56.200629 IP selab-03.54838 > bom12s17-in-f3.1e100.net.https: Flags [P.], seq 2455686671:2455686710, ack 2496807466, win 8856, options [nop,nop,TS val 733296365 ecr 2153227738], length 39
10:30:56.252770 IP bom12s13-in-f2.1e100.net.https > selab-03.54784: Flags [P.], seq 1:40, ack 39, win 269, options [nop,nop,TS val 1984760275 ecr 2507564863], length 39
10:30:56.252770 IP bom12s17-in-f3.1e100.net.https > selab-03.54838: Flags [P.], seq 1:40, ack 39, win 442, options [nop,nop,TS val 2153286308 ecr 733296365], length 39
10:30:56.252793 IP selab-03.54784 > bom12s13-in-f2.1e100.net.https: Flags [.], ack 40, win 501, options [nop,nop,TS val 2507564916 ecr 1984760275], length 0
10:30:56.252802 IP selab-03.54838 > bom12s17-in-f3.1e100.net.https: Flags [.], ack 40, win 8856, options [nop,nop,TS val 733296418 ecr 2153286308], length 0
10:30:56.292880 IP selab-03.47701 > mpl-dc-adc01.manipal.edu.domain: 607+ [1au] PTR? 98.183.250.142.in-addr.arpa. (56)
10:30:56.293270 IP mpl-dc-adc01.manipal.edu.domain > selab-03.47701: 607 1/0/1 PTR bom12s13-in-f2.1e100.net. (94)
10:30:56.293591 IP selab-03.53760 > mpl-dc-adc01.manipal.edu.domain: 54427+ [1au] PTR? 99.192.250.142.in-addr.arpa. (56)
10:30:56.293931 IP mpl-dc-adc01.manipal.edu.domain > selab-03.53760: 54427 1/0/1 PTR bom12s17-in-f3.1e100.net. (94)
10:31:01.200998 IP selab-03.60422 > bom12s21-in-f4.1e100.net.https: Flags [P.], seq 1668254070:1668254109, ack 687728030, win 8700, options [nop,nop,TS val 1321497597 ecr 3591638757], length 39
10:31:01.256241 IP bom12s21-in-f4.1e100.net.https > selab-03.60422: Flags [.], ack 39, win 714, options [nop,nop,TS val 3591697483 ecr 1321497597], length 0
10:31:01.256241 IP bom12s21-in-f4.1e100.net.https > selab-03.60422: Flags [P.], seq 1:40, ack 39, win 714, options [nop,nop,TS val 3591697483 ecr 1321497597], length 39
10:31:01.288864 IP selab-03.52503 > mpl-dc-adc01.manipal.edu.domain: 44151+ [1au] PTR? 68.42.251.142.in-addr.arpa. (55)
10:31:01.289263 IP mpl-dc-adc01.manipal.edu.domain > selab-03.52503: 44151 1/0/1 PTR bom12s21-in-f4.1e100.net. (93)
10:31:01.296631 IP selab-03.60422 > bom12s21-in-f4.1e100.net.https: Flags [.], ack 40, win 8700, options [nop,nop,TS val 1321497692 ecr 3591697483], length 0
10:31:09.898773 IP lb-140-82-113-26-iad.github.com.https > selab-03.52102: Flags [P.], seq 2584716168:2584716194, ack 4079922419, win 69, options [nop,nop,TS val 1277517920 ecr 1295153502], length 26
10:31:09.898936 IP selab-03.52102 > lb-140-82-113-26-iad.github.com.https: Flags [P.], seq 1:31, ack 26, win 501, options [nop,nop,TS val 1295213503 ecr 1277517920], length 30
10:31:09.920795 IP selab-03.47491 > mpl-dc-adc01.manipal.edu.domain: 9491+ [1au] PTR? 26.113.82.140.in-addr.arpa. (55)
10:31:10.224068 IP lb-140-82-113-26-iad.github.com.https > selab-03.52102: Flags [.], ack 31, win 69, options [nop,nop,TS val 1277518245 ecr 1295213503], length 0
10:31:12.994977 IP mpl-dc-adc01.manipal.edu.domain > selab-03.47491: 9491 1/0/1 PTR lb-140-82-113-26-iad.github.com. (100)
10:31:20.014822 IP selab-03.43312 > hyperion.poly.edu.http-alt: Flags [S], seq 1604266485, win 64240, options [mss 1460,sackOK,TS val 717127254 ecr 0,nop,wscale 7], length 0
10:31:20.020796 IP selab-03.47152 > mpl-dc-adc01.manipal.edu.domain: 17475+ [1au] PTR? 86.38.238.128.in-addr.arpa. (55)
10:31:20.280540 IP hyperion.poly.edu.http-alt > selab-03.43312: Flags [S.], seq 1105900519, ack 1604266486, win 28960, options [mss 1412,sackOK,TS val 2194574598 ecr 717127254,nop,wscale 10], length 0
10:31:20.280564 IP selab-03.43312 > hyperion.poly.edu.http-alt: Flags [.], ack 1, win 502, options [nop,nop,TS val 717127519 ecr 2194574598], length 0
10:31:23.623468 IP mpl-dc-adc01.manipal.edu.domain > selab-03.47152: 17475 1/0/1 PTR hyperion.poly.edu. (86)
10:31:25.280962 IP selab-03.43312 > hyperion.poly.edu.http-alt: Flags [F.], seq 1, ack 1, win 502, options [nop,nop,TS val 717132520 ecr 2194574598], length 0
10:31:25.550529 IP hyperion.poly.edu.http-alt > selab-03.43312: Flags [F.], seq 1, ack 2, win 29, options [nop,nop,TS val 2194575915 ecr 717132520], length 0
10:31:25.550552 IP selab-03.43312 > hyperion.poly.edu.http-alt: Flags [.], ack 2, win 502, options [nop,nop,TS val 717132789 ecr 2194575915], length 0
10:31:27.312631 IP selab-03.48132 > vm-host-1.isis.poly.edu.telnet: Flags [S], seq 1360721614, win 64240, options [mss 1460,sackOK,TS val 2154541747 ecr 0,nop,wscale 7], length 0
10:31:28.015294 IP selab-03.46912 > 239.237.117.34.bc.googleusercontent.com.https: Flags [P.], seq 39:78, ack 40, win 501, options [nop,nop,TS val 1416657505 ecr 1961450665], length 39
10:31:28.015331 IP selab-03.33018 > 102.115.120.34.bc.googleusercontent.com.https: Flags [P.], seq 39:78, ack 40, win 501, options [nop,nop,TS val 2034179976 ecr 3159155298], length 39
10:31:28.065728 IP 102.115.120.34.bc.googleusercontent.com.https > selab-03.33018: Flags [P.], seq 40:79, ack 78, win 273, options [nop,nop,TS val 3159214105 ecr 2034179976], length 39
10:31:28.065729 IP 239.237.117.34.bc.googleusercontent.com.https > selab-03.46912: Flags [P.], seq 40:79, ack 78, win 272, options [nop,nop,TS val 1961509476 ecr 1416657505], length 39
10:31:28.065753 IP selab-03.33018 > 102.115.120.34.bc.googleusercontent.com.https: Flags [.], ack 79, win 501, options [nop,nop,TS val 2034180027 ecr 3159214105], length 0
10:31:28.065760 IP selab-03.46912 > 239.237.117.34.bc.googleusercontent.com.https: Flags [.], ack 79, win 501, options [nop,nop,TS val 1416657556 ecr 1961509476], length 0
10:31:30.008454 IP selab-03.45212 > mpl-dc-adc01.manipal.edu.domain: 2684+ [1au] A? connectivity-check.ubuntu.com. (58)
10:31:30.009051 IP mpl-dc-adc01.manipal.edu.domain > selab-03.45212: 2684 9/0/1 A 34.122.121.32, A 185.125.190.17, A 185.125.190.18, A 185.125.190.48, A 185.125.190.49, A 35.232.111.17, A 91.189.91.49, A 91.189.91.48, A 35.224.170.84 (202)
10:31:30.009512 IP selab-03.59844 > 32.121.122.34.bc.googleusercontent.com.http: Flags [S], seq 2896224424, win 64240, options [mss 1460,sackOK,TS val 792675841 ecr 0,nop,wscale 7], length 0
10:31:30.020947 IP selab-03.41336 > mpl-dc-adc01.manipal.edu.domain: 13868+ [1au] PTR? 32.121.122.34.in-addr.arpa. (55)
10:31:30.052845 IP mpl-dc-adc01.manipal.edu.domain > selab-03.41336: 13868 1/0/1 PTR 32.121.122.34.bc.googleusercontent.com. (107)
10:31:31.024510 IP selab-03.59844 > 32.121.122.34.bc.googleusercontent.com.http: Flags [S], seq 2896224424, win 64240, options [mss 1460,sackOK,TS val 792676856 ecr 0,nop,wscale 7], length 0
10:31:31.284111 IP 32.121.122.34.bc.googleusercontent.com.http > selab-03.59844: Flags [S.], seq 3838297288, ack 2896224425, win 64768, options [mss 1412,sackOK,TS val 1555138924 ecr 792676856,nop,wscale 7], length 0
10:31:31.284154 IP selab-03.59844 > 32.121.122.34.bc.googleusercontent.com.http: Flags [.], ack 1, win 502, options [nop,nop,TS val 792677116 ecr 1555138924], length 0
10:31:31.284363 IP selab-03.59844 > 32.121.122.34.bc.googleusercontent.com.http: Flags [P.], seq 1:88, ack 1, win 502, options [nop,nop,TS val 792677116 ecr 1555138924], length 87: HTTP: GET / HTTP/1.1
10:31:31.285344 IP 32.121.122.34.bc.googleusercontent.com.http > selab-03.59844: Flags [.], ack 88, win 506, length 0
10:31:31.680587 IP 32.121.122.34.bc.googleusercontent.com.http > selab-03.59844: Flags [P.], seq 1:149, ack 88, win 502, options [nop,nop,TS val 1555139378 ecr 792677116], length 148: HTTP: HTTP/1.1 204 No Content
10:31:31.680588 IP 32.121.122.34.bc.googleusercontent.com.http > selab-03.59844: Flags [F.], seq 149, ack 88, win 502, options [nop,nop,TS val 1555139380 ecr 792677116], length 0
10:31:31.680613 IP selab-03.59844 > 32.121.122.34.bc.googleusercontent.com.http: Flags [.], ack 149, win 501, options [nop,nop,TS val 792677512 ecr 1555139378], length 0
10:31:31.680842 IP selab-03.59844 > 32.121.122.34.bc.googleusercontent.com.http: Flags [F.], seq 88, ack 150, win 501, options [nop,nop,TS val 792677513 ecr 1555139380], length 0
10:31:31.944364 IP 32.121.122.34.bc.googleusercontent.com.http > selab-03.59844: Flags [.], ack 89, win 502, options [nop,nop,TS val 1555139644 ecr 792677513], length 0
10:31:31.947925 IP 32.121.122.34.bc.googleusercontent.com.http > selab-03.59844: Flags [.], ack 89, win 502, options [nop,nop,TS val 1555139648 ecr 792677513], length 0
10:31:31.947944 IP selab-03.59844 > 32.121.122.34.bc.googleusercontent.com.http: Flags [R], seq 2896224513, win 0, length 0
10:31:48.281601 IP selab-03.57774 > bom12s21-in-f14.1e100.net.https: Flags [P.], seq 39:78, ack 40, win 501, options [nop,nop,TS val 842716760 ecr 363274069], length 39
10:31:48.281684 IP selab-03.57774 > bom12s21-in-f14.1e100.net.https: Flags [FP.], seq 78:102, ack 40, win 501, options [nop,nop,TS val 842716760 ecr 363274069], length 24
10:31:48.331845 IP bom12s21-in-f14.1e100.net.https > selab-03.57774: Flags [.], ack 103, win 265, options [nop,nop,TS val 363327154 ecr 842716760], length 0
10:31:48.331846 IP bom12s21-in-f14.1e100.net.https > selab-03.57774: Flags [F.], seq 40, ack 103, win 265, options [nop,nop,TS val 363327154 ecr 842716760], length 0
10:31:48.331878 IP selab-03.57774 > bom12s21-in-f14.1e100.net.https: Flags [.], ack 41, win 501, options [nop,nop,TS val 842716811 ecr 363327154], length 0
10:31:49.281849 IP selab-03.52146 > bom07s16-in-f2.1e100.net.https: Flags [P.], seq 39:78, ack 40, win 501, options [nop,nop,TS val 1253923893 ecr 2062148807], length 39
10:31:49.281881 IP selab-03.54784 > bom12s13-in-f2.1e100.net.https: Flags [P.], seq 39:78, ack 40, win 501, options [nop,nop,TS val 2507617945 ecr 1984760275], length 39
10:31:49.281967 IP selab-03.52146 > bom07s16-in-f2.1e100.net.https: Flags [FP.], seq 78:102, ack 40, win 501, options [nop,nop,TS val 1253923893 ecr 2062148807], length 24
10:31:49.282106 IP selab-03.54784 > bom12s13-in-f2.1e100.net.https: Flags [P.], seq 78:102, ack 40, win 501, options [nop,nop,TS val 2507617945 ecr 1984760275], length 24
10:31:49.282109 IP selab-03.54784 > bom12s13-in-f2.1e100.net.https: Flags [F.], seq 102, ack 40, win 501, options [nop,nop,TS val 2507617945 ecr 1984760275], length 0
10:31:49.337914 IP bom12s13-in-f2.1e100.net.https > selab-03.54784: Flags [.], ack 78, win 269, options [nop,nop,TS val 1984813360 ecr 2507617945,nop,nop,sack 1 {102:103}], length 0
10:31:49.338839 IP bom07s16-in-f2.1e100.net.https > selab-03.52146: Flags [.], ack 103, win 269, options [nop,nop,TS val 2062202884 ecr 1253923893], length 0
10:31:49.338839 IP bom07s16-in-f2.1e100.net.https > selab-03.52146: Flags [F.], seq 40, ack 103, win 269, options [nop,nop,TS val 2062202884 ecr 1253923893], length 0
10:31:49.338872 IP selab-03.52146 > bom07s16-in-f2.1e100.net.https: Flags [.], ack 41, win 501, options [nop,nop,TS val 1253923950 ecr 2062202884], length 0
10:31:49.341939 IP bom12s13-in-f2.1e100.net.https > selab-03.54784: Flags [.], ack 103, win 269, options [nop,nop,TS val 1984813364 ecr 2507617945], length 0
10:31:49.341940 IP bom12s13-in-f2.1e100.net.https > selab-03.54784: Flags [F.], seq 40, ack 103, win 269, options [nop,nop,TS val 1984813364 ecr 2507617945], length 0
10:31:49.341974 IP selab-03.54784 > bom12s13-in-f2.1e100.net.https: Flags [.], ack 41, win 501, options [nop,nop,TS val 2507618005 ecr 1984813364], length 0
10:31:50.282249 IP selab-03.54838 > bom12s17-in-f3.1e100.net.https: Flags [P.], seq 39:78, ack 40, win 8856, options [nop,nop,TS val 733350447 ecr 2153286308], length 39
10:31:50.282326 IP selab-03.54838 > bom12s17-in-f3.1e100.net.https: Flags [FP.], seq 78:102, ack 40, win 8856, options [nop,nop,TS val 733350447 ecr 2153286308], length 24
10:31:50.335466 IP bom12s17-in-f3.1e100.net.https > selab-03.54838: Flags [.], ack 103, win 442, options [nop,nop,TS val 2153340386 ecr 733350447], length 0
10:31:50.335466 IP bom12s17-in-f3.1e100.net.https > selab-03.54838: Flags [F.], seq 40, ack 103, win 442, options [nop,nop,TS val 2153340386 ecr 733350447], length 0
10:31:50.335499 IP selab-03.54838 > bom12s17-in-f3.1e100.net.https: Flags [.], ack 41, win 8856, options [nop,nop,TS val 733350500 ecr 2153340386], length 0
10:32:00.016186 IP selab-03.60422 > bom12s21-in-f4.1e100.net.https: Flags [P.], seq 39:78, ack 40, win 8700, options [nop,nop,TS val 1321556412 ecr 3591697483], length 39
10:32:00.072526 IP bom12s21-in-f4.1e100.net.https > selab-03.60422: Flags [P.], seq 40:79, ack 78, win 714, options [nop,nop,TS val 3591756297 ecr 1321556412], length 39
10:32:00.072545 IP selab-03.60422 > bom12s21-in-f4.1e100.net.https: Flags [.], ack 79, win 8700, options [nop,nop,TS val 1321556468 ecr 3591756297], length 0
10:32:09.899670 IP lb-140-82-113-26-iad.github.com.https > selab-03.52102: Flags [P.], seq 26:52, ack 31, win 69, options [nop,nop,TS val 1277577919 ecr 1295213503], length 26
10:32:09.899800 IP selab-03.52102 > lb-140-82-113-26-iad.github.com.https: Flags [P.], seq 31:61, ack 52, win 501, options [nop,nop,TS val 1295273504 ecr 1277577919], length 30
10:32:10.224679 IP lb-140-82-113-26-iad.github.com.https > selab-03.52102: Flags [.], ack 61, win 69, options [nop,nop,TS val 1277578244 ecr 1295273504], length 0
10:32:21.282854 IP selab-03.46912 > 239.237.117.34.bc.googleusercontent.com.https: Flags [P.], seq 78:117, ack 79, win 501, options [nop,nop,TS val 1416710773 ecr 1961509476], length 39
10:32:21.282875 IP selab-03.33018 > 102.115.120.34.bc.googleusercontent.com.https: Flags [P.], seq 78:117, ack 79, win 501, options [nop,nop,TS val 2034233244 ecr 3159214105], length 39
10:32:21.282958 IP selab-03.33018 > 102.115.120.34.bc.googleusercontent.com.https: Flags [FP.], seq 117:141, ack 79, win 501, options [nop,nop,TS val 2034233244 ecr 3159214105], length 24
10:32:21.283109 IP selab-03.46912 > 239.237.117.34.bc.googleusercontent.com.https: Flags [P.], seq 117:141, ack 79, win 501, options [nop,nop,TS val 1416710773 ecr 1961509476], length 24
10:32:21.283112 IP selab-03.46912 > 239.237.117.34.bc.googleusercontent.com.https: Flags [F.], seq 141, ack 79, win 501, options [nop,nop,TS val 1416710773 ecr 1961509476], length 0
10:32:21.310233 IP 239.237.117.34.bc.googleusercontent.com.https > selab-03.46912: Flags [.], ack 78, win 277, options [nop,nop,TS val 1961562739 ecr 1416657556,nop,nop,sack 1 {117:141}], length 0
10:32:21.313925 IP 102.115.120.34.bc.googleusercontent.com.https > selab-03.33018: Flags [.], ack 142, win 273, options [nop,nop,TS val 3159267376 ecr 2034233244], length 0
10:32:21.313925 IP 102.115.120.34.bc.googleusercontent.com.https > selab-03.33018: Flags [F.], seq 79, ack 142, win 273, options [nop,nop,TS val 3159267376 ecr 2034233244], length 0
10:32:21.313925 IP 239.237.117.34.bc.googleusercontent.com.https > selab-03.46912: Flags [.], ack 78, win 288, options [nop,nop,TS val 1961562743 ecr 1416657556,nop,nop,sack 1 {117:142}], length 0
10:32:21.313960 IP selab-03.33018 > 102.115.120.34.bc.googleusercontent.com.https: Flags [.], ack 80, win 501, options [nop,nop,TS val 2034233275 ecr 3159267376], length 0
10:32:21.317821 IP 239.237.117.34.bc.googleusercontent.com.https > selab-03.46912: Flags [.], ack 142, win 288, options [nop,nop,TS val 1961562747 ecr 1416710773], length 0
10:32:21.317822 IP 239.237.117.34.bc.googleusercontent.com.https > selab-03.46912: Flags [F.], seq 79, ack 142, win 288, options [nop,nop,TS val 1961562747 ecr 1416710773], length 0
10:32:21.317856 IP selab-03.46912 > 239.237.117.34.bc.googleusercontent.com.https: Flags [.], ack 80, win 501, options [nop,nop,TS val 1416710808 ecr 1961562747], length 0
10:32:25.707647 ARP, Request who-has selab-03 tell 172.16.48.22, length 46
10:32:25.707653 ARP, Reply selab-03 is-at 48:9e:bd:9f:a6:aa (oui Unknown), length 28
10:32:25.708112 IP 172.16.48.22.netbios-ssn > selab-03.41892: Flags [.], seq 0:1, ack 1, win 65, length 1
10:32:25.708129 IP selab-03.41892 > 172.16.48.22.netbios-ssn: Flags [.], ack 1, win 501, options [nop,nop,TS val 3803289685 ecr 481660,nop,nop,sack 1 {0:1}], length 0
10:32:28.610506 IP selab-03.60422 > bom12s21-in-f4.1e100.net.https: Flags [P.], seq 78:283, ack 79, win 8700, options [nop,nop,TS val 1321585006 ecr 3591756297], length 205
10:32:28.610550 IP selab-03.60961 > mpl-dc-adc01.manipal.edu.domain: 37706+ [1au] A? www.google.com. (43)
10:32:28.610585 IP selab-03.57406 > mpl-dc-adc01.manipal.edu.domain: 42591+ [1au] AAAA? www.google.com. (43)
10:32:28.610789 IP selab-03.60422 > bom12s21-in-f4.1e100.net.https: Flags [P.], seq 283:314, ack 79, win 8700, options [nop,nop,TS val 1321585007 ecr 3591756297], length 31
10:32:28.610906 IP mpl-dc-adc01.manipal.edu.domain > selab-03.60961: 37706 1/0/1 A 142.250.182.228 (59)
10:32:28.610907 IP mpl-dc-adc01.manipal.edu.domain > selab-03.57406: 42591 1/0/1 AAAA 2404:6800:4009:82e::2004 (71)
10:32:28.661796 IP bom12s21-in-f4.1e100.net.https > selab-03.60422: Flags [.], ack 283, win 725, options [nop,nop,TS val 3591784888 ecr 1321585006], length 0
10:32:28.665660 IP bom12s21-in-f4.1e100.net.https > selab-03.60422: Flags [.], ack 314, win 725, options [nop,nop,TS val 3591784892 ecr 1321585007], length 0
10:32:28.723599 IP bom12s21-in-f4.1e100.net.https > selab-03.60422: Flags [P.], seq 79:311, ack 314, win 725, options [nop,nop,TS val 3591784950 ecr 1321585007], length 232
10:32:28.723600 IP bom12s21-in-f4.1e100.net.https > selab-03.60422: Flags [P.], seq 311:342, ack 314, win 725, options [nop,nop,TS val 3591784950 ecr 1321585007], length 31
10:32:28.723600 IP bom12s21-in-f4.1e100.net.https > selab-03.60422: Flags [P.], seq 342:381, ack 314, win 725, options [nop,nop,TS val 3591784950 ecr 1321585007], length 39
10:32:28.723622 IP selab-03.60422 > bom12s21-in-f4.1e100.net.https: Flags [.], ack 311, win 8700, options [nop,nop,TS val 1321585119 ecr 3591784950], length 0
10:32:28.723626 IP selab-03.60422 > bom12s21-in-f4.1e100.net.https: Flags [.], ack 342, win 8700, options [nop,nop,TS val 1321585119 ecr 3591784950], length 0
10:32:28.723628 IP selab-03.60422 > bom12s21-in-f4.1e100.net.https: Flags [.], ack 381, win 8700, options [nop,nop,TS val 1321585119 ecr 3591784950], length 0
10:32:28.723824 IP selab-03.60422 > bom12s21-in-f4.1e100.net.https: Flags [P.], seq 314:353, ack 381, win 8700, options [nop,nop,TS val 1321585120 ecr 3591784950], length 39
10:32:28.770313 IP bom12s21-in-f4.1e100.net.https > selab-03.60422: Flags [.], ack 353, win 725, options [nop,nop,TS val 3591784997 ecr 1321585120], length 0
10:32:28.774423 IP bom12s21-in-f4.1e100.net.https > selab-03.60422: Flags [.], ack 353, win 725, options [nop,nop,TS val 3591785001 ecr 1321585120], length 0
10:32:30.800504 ARP, Request who-has 172.16.48.22 tell selab-03, length 28
10:32:30.801167 ARP, Reply 172.16.48.22 is-at 8c:89:a5:e8:c9:3e (oui Unknown), length 46
10:33:09.900045 IP lb-140-82-113-26-iad.github.com.https > selab-03.52102: Flags [P.], seq 52:78, ack 61, win 69, options [nop,nop,TS val 1277637917 ecr 1295273504], length 26
10:33:09.900120 IP selab-03.52102 > lb-140-82-113-26-iad.github.com.https: Flags [P.], seq 61:91, ack 78, win 501, options [nop,nop,TS val 1295333504 ecr 1277637917], length 30
10:33:10.223315 IP lb-140-82-113-26-iad.github.com.https > selab-03.52102: Flags [.], ack 91, win 69, options [nop,nop,TS val 1277638240 ecr 1295333504], length 0
10:33:14.007280 IP 55.65.117.34.bc.googleusercontent.com.https > selab-03.60848: Flags [P.], seq 3389218887:3389218911, ack 2687588525, win 272, options [nop,nop,TS val 1086201368 ecr 1914749643], length 24
10:33:14.007392 IP selab-03.60848 > 55.65.117.34.bc.googleusercontent.com.https: Flags [P.], seq 1:29, ack 24, win 501, options [nop,nop,TS val 1915049876 ecr 1086201368], length 28
10:33:14.032920 IP selab-03.45945 > mpl-dc-adc01.manipal.edu.domain: 5688+ [1au] PTR? 55.65.117.34.in-addr.arpa. (54)
10:33:14.038332 IP 55.65.117.34.bc.googleusercontent.com.https > selab-03.60848: Flags [.], ack 29, win 272, options [nop,nop,TS val 1086201400 ecr 1915049876], length 0
10:33:14.042912 IP mpl-dc-adc01.manipal.edu.domain > selab-03.45945: 5688 1/0/1 PTR 55.65.117.34.bc.googleusercontent.com. (105)
^C
175 packets captured
175 packets received by filter
0 packets dropped by kernel
